review,sentiment
salena incident set arizona six death row inmate transfered state prison reason never explained driving along heavily armed prison bus get flat driver forced pull road two blonde bird turn seducing incompetent prison guard manage get better six prisoner released shoot getaway car damaged leaving stranded middle arizona desert decide head nearest town salena several mile away take cop hostage reach salena find odd place completely deserted one single person sight soon discover entire town killed flesh eating alien firmly placed menu br br also known alien invasion arizona u dvd apparently working title terror town rubbishy low budget sci fi horror flick co written co produced directed dustin rikert real redeeming feature frank salena incident sort film give film bad name film could roughly divided two part opening forty fifty odd minute focus prisoner thriller feeling opening guard escape although pretty poorly written staged stuff dialogue two blonde bird prison guard bad unintentionally funny two fit bird chat two fit prison guard funny stuff actually unfortunately salena incident supposed sci fi horror film comedy escaped con prison guard hostage arrive salena go sci fi horror mode alien turn start killing clichéd character good annoying look whole film suck badly written thought made really bothered go trust salena incident awful every level br br well bad boring stupid film salena incident also poorly made action set piece scene awful alien look terrible never shown screen time human character sometimes difficult tell happening special effect poor alien look rubbish cgi computer effect absolutely terrible well editing poor cinematography poor set cheap whole thing eyesore really bit gore gunshot wound someone ripped half severed hand seen br br obviously shot low budget salena incident low production value look cheap start finish filmed superior arizona acting terrible one ever heard although actress play female doctor pretty good looking br br salena incident rubbish sci fi horror film terrible every way worth minute mine anyone else time,0
anyone think kool moe dee carol alt corey feldman comprise list good actor must smoking something love try sometime begin lousy soundtrack hammy acting action place typical amateurishly written hack fodder washed never love star actually felt embarrassed star film thespian missing top turd gary coleman would movie would made least somewhat howlingly bad rather plain bad br br one part film carol alt screamed think idiot yes carol agent please love decent holy go away stop degrading like film something anna nicole smith would take part br br would tell plot would one sentence fragment article plus mind drifted many time movie anyway barely paid attention,0
sleepless night switching channel found embarrassment movie thinking br br life remote control kari wuhrer salin wonder gone nowhere br br david keith take role pathetic br br anyway turned movie near end get much plot must best part nerdy college kid brings home dominatrix ish girl scene straight comic book cheap porn movie call mother anal retentive kiss father oh expect tongue great line br br see ended br br well course bitch hell helluva past swat team upstairs yes surround yes yes kid blow brain ahahhahahaha br br must see tv br br,0
un funny un entertaining possibly worst movie ever misfortune watch think ernest go humour done even worse girlfriend sat see could consistently dire seems opening sequence yes avoid cost,0
quentin tarantino partner crime roger avary co writer pulp fiction venture q go exec prod time boiled french thriller br br eric stoltz zed safe cracker extraordinaire drifted france u request old friend team motley crew drugged hippy little planning think knock bank vault full gold bullion french national holiday br br avary reworked robbery gone wrong theme tarantino developed well reservoir dog killing zoe good enough survive strength alone avary thrown rather beautiful distraction julie delpy zoe student come call girl entertains zed arrival paris stunning distraction certainly nothing br br guess director wanted add different angle basic theme sadly move help add depth shallow plot desperately needed never story idea nothing idea even surreal journey seedy dive paris uninspiring figure one would concede never much movie story bunch gangster shooting botched jewellery heist either add intricate character snappy dialogue reservoir dog killing zoe br br stoltz strong interpretation doubtful zed jean hughes anglade mad portrayal obsessive ring leader nothing lift proceeding short avary unsuccessfully attempted conjure entertainment nothing br br friday september astor theatre,0
probably best cinematic depiction life manhattan ad agency pressure perform client agency demand party creativity money cool surface powerful corporate undercurrent br br toss parenthood dustin hoffman br br movie textured deep follows internal relationship try understand live going relationship meryl streep friend becomes friend relationship son br br meryl streep great set record least screen time win oscar sure deliver though,1
believe actually sat thru entire film friend rented jacket made sound good defense jacket correct supposed haunted room someone slept overnight jacket sounded like par freddy jason maybe shining farther truth br br fan minimalist surrealist film may enjoy looking good fright movie couple thrill go rent jason v freddy iv much better night,0
hearing rumor upcoming leonard nimoy demonstrates blu ray disc advance past year ranging steady cam cgi interesting see franchise reinvigorated hope help remove bad taste left mouth whole magnavision demonstration fiasco br br yes leonard nimoy demonstrates betamax vcr brilliant milestone entertainment history tentative leonard nimoy demonstrates compact cassette downright tacky leonard nimoy demonstrates track tape would expected glorious piece cinema weeping right thinking,0
discovered film love right mix fast moving story entertaining character hilarious moment overloaded stupid joke fun performance kelsey grammar harry dean stanton ron schneider rip torn buckman especially good really enjoyed watching guy played stapanick br br also find interesting used real submarine pampanito running top scene emulated almost exactly set set decoration really impressive digital tour pampanito online compare scene movie excellent job film br br light entertaining truly enjoyable movie,1
seen movie twice time cinemax first time unrated version soft core porn best second time trimmed cut sex nudity version entertaining typical beach movie sort way unrated version tremendous sex scene nikki fritz dude bottle oil world pun intended unfortunately trimmed version scene almost completely chopped sex scene rated unrated still fun watch sibling bigger star stallone sheen travolta etc trying act also get appearance b queen linnea quigley burt ward robin old batman series,1
principally story two men part portuguese revolution easy understand contest usually director start historical fact speak something else show also period fact everything happen couple day revolution act could also seen kind documentary movie focalize two people showing normal like common hero revolution come people although made military army title understand capitaes main character nice color light whole movie excellent work director first movie fall banal way well shown emotion passion people crowd character maia main one well made also good interpretation stefano accorsi able show maia limit hero,1
never impressed night gallery one episode stand br br tv network executive audition odd act young nerdy boy proceeds make prognostication exec dismisses whole thing flaky waste time prediction come true next morning br br first seemed parlor act becomes hit show kid prediction prove consistently accurate br br one day refuse show facing imminent showtime everyone wit end even threatening legal action fulfill contract make daily prediction br br young boy relents foretells seemingly utopian tomorrow br br show befuddled executive asks explanation learn complete truth terrifying reveal,1
exactly new story line romantic comedy make concept work young man john cusack drop dead gorgeous woman kate beckinsale keep meeting chance wonder meant although promised others oddly enough still feel soul mate somewhere little sappy place viva la love romantic almost obligated riveted favorite scene cusack ground snow start falling finale almost sweet deserving one cusack deeper role hell could smitten beckinsale notable support provided jeremy piven molly shannon john corbett play worst role ever seen hand eugene levy quirky funny watch soul mate,0
greedy sum depth movie rest baloney big budget window dressing movie rotates hiding ball annoyingly revealing much none potentially interesting plot tangent developed yet trite one hashed rehashed excess br br charm dd others pointed schizophrenia device humor woven fabric movie importantly acting enough wooden acting box attract giant mound martian termite br br biggest problem suspending disbelief mess glaring question would technologically superior power capable taking government need testing awful failure movie,0
guessing matter fan car luv sound dodge challenger growl along road noise chevy make scream ecstasy tear round corner blast sound classic vehicle burst flame explodes biggest car enthusiast stretch imagination really rev engine denying importance transport cinema even said invention train one biggest influence early cinema looking window almost like moving picture idea transported different time space car remains popular luved even got genre carsploitation genre genre focus purely beauty car effect porn car porn talking rather nasty documentary channel men actually sexual intercourse car whatever float car guess moving whilst running empty quite pornographic vanishing point richard c sarafian instance close ups car motion bump curve mean car main focus film fact car become character later objectified fetishised much woman fact maybe even holy holy car something every car film besides one background simply beautiful  work art question br br saying incredible car way given character actually start sympathising car spoiler  notably scene car wrecked burnt spoiler become almost convention carsploitation genre evil plymouth fury christine john carpenter satan custom lincoln mark iii car elliot silverstein nifty little mini cooper italian job peter collinson friendly volkswagen beetle love bug robert stevenson course car death race paul bartel even wacky race character ironically however emphasis car often take human character certainly case running empty one human character blind character drive car hearing rather sight sort dimension rest much stock character stereotypical australian teenager big hair annoying accent none would look place neighbour especially kylie minouge look like give damn car racing crashing like really watching wrong genre br br car scene certainly selling point film best thing got going fast fast talking rather annoying technique film seem use record car speeding around mph speed oooh film car zooming along top speed real time  fancy editing trick got speed check crash check check check whilst car crashing everywhere la incredibly blue brother john landis car crash film certainly crash would seem use gunpowder something similar build car one little hit kaboom flame kind reminded thriller cruel picture bo arne vibenius sense br br simply awesome scene especially start end quite scene slow everything done opinion fail add much film note exploding car needed however couple exception great scene  spoiler especially attempted rape scene br br man film boy film full car vroom vroom vrooming around outback couple tit thrown good measure recommend little film anyone even keen cyclist  great film switch brain sit back leather chair put full volume give luvs luvs  bruuuuum p  amazon selling £  real bargain although dvd lack special feature whatsoever,1
screenwriter director intended open heart movie musician wanted music succeeded commonplace human situation became original personal immediate personally felt touched situation believe would credit power music combined point view person writing movie without spoiling say moved movie approach living actually cried joy empathy deep emotion long time would love find way show others saw seattle international film festival,1
main reason see film warren william top form shyster campaign manager electric constantly finding way fool public defeat opposing party midst biggest disaster william great actor feel never got due bette davis girlfriend also shine written role personally found guy kibbee quite right lame brained candidate william others trying foist public seemed like empty canvas person would preferred see real character emerge rather non character story implausible silly clichéd warren william bette davis well worth watching,1
sure show one familiar might think good almost close baywatch hawaii cast location style directing publicity  show woman walking around beach wonder people misconception decide watch br br wrong cause decide watch show actually thing going real juicy story conflict turn really exciting watch pretty much  addictive br br story hotel clerk manager owner complicated love life also enter troublesome hotel visitor powerful man trying steal hotel actually exciting sound br br deny acting suck bad look away story consistence good enough soundtrack fitting pretty well scenario action time took couple episode actually anything happen solidly patience br br recommendation really enjoy watching zillion time better expected br br rating grade b br br please rate review reading thanks,1
movie collection inexpensive b movie restored fact audio difficult discern first minute br br first seemed like typical haunted house film feel much like forerunner clue murder death house haunted hill etc br br half hour film storyline take really interesting twist go cliché melodrama something entirely different far entertaining initially thought br br check great deal fun even long clip wider shot near lack music score make feel bit creaky today standard,1
really wanted like pillow book intriguing story interesting character outline ewan macgregor utterly glorious altogether unfortunately hated every minute greenaway got enamoured presenting movie uniquely film benefit even get vivian wu abysmal acting br br get distracted story billion teeny window calligraphy roll bottom screen displaying lyric music playing seems lost sight presenting actual story developing plot got entangled foo foo embellishment nothing anything bit like presenting john singer sargeant portrait chintzy hallmark frame say grandma love big sparkly letter br br movie seems casualty director auteur ego instead could disturbingly horrifyingly beautiful another director hand jeunet coppola could masterpiece greenaway hand best relegated fine art class also take seriously,0
diego armando maradona still remains best football player game offered athlete artist documetary world cup forever live memory every football fan around world tremendous unbelievable goal scored country england absolutely point diminishing star although dont undersand spanish appreciate argentine narrator actually cry happiness barely express emotion anything wrote senseless difficult comprehend reader watch know mean,1
need say much good documentary truly amazing piece true narrative story simple enough white senior citizen tourist murdered young black man florida boy arrested mistreated put trial public defender family side enthralling public defender joy watch human way help pull triumph justice ending fulfills could expected true story br br shame people seen documentary hopefully find way watch interested race relation united state actual working law enforcement legal process well worth time effort find documentary give,1
within first minute movie knew one pick fault kinda movie acting terrible script even worse ever let people write write crap movie need feed komodo russian mig jet posing u air force jet pistol miraculously shoot round rapid fire without reloading poor detail story one scene komodo killing special force troop night another explaining komodos cobra cold blooded come night also fantastic special effect available today movie industry average even low budget movie br br said watch end curious wonder bad film making could produce shame shame shame producing rot br br movie left cutting room floor,0
insulted movie even funny thought mulan unbelievable however low expectation disney become never figured something stereotypical yet respect true chinese culture hollywood tradition random martial art br br appreciate tried make wendy normal teenage girl fortunately normal teenage girl particularly asian teenage girl much less obsessed shallow aspect life cultural stand point almost impossible yes girl wrapped popularity fashion pretty rare even one still fairly decent scholar another stereotype maybe fairly true one chinese parent work chinese value work wanted go authenticity would made wendy ironic girl glass love hate relationship family br br add frustration american movie asian culture meditation vague nature oriented phrase sound wise walk around smiling enigmatically time know form martial art people appreciate someone would write asian part portray u sad caricature,0
completely forgotten midnight madness found surfing imdb coming back br br one naughton first movie well fox sharp eyed connoisseur also pick kaplan henry tv alice fiedler voice piglet winnie pooh cartoon blocker son dan hoss blocker tv bonanza br br two stand mind furst animal house superdude eddie deezen furst play baddie time one best scene asks dad accept dad look obese slovenly frame give simple one word response yuck br br deezen well show latter day jerry lewis stumble around wade mini golf pond put melon half ear end maggie roswell fall hero br br film typical early stupidity college kid staying curfew going city wide scavenger hunt prove division student best campus jock nerd rich kid feminist group made little br br win care lot fun watching disney picture first foray pg territory creating touchstone picture br br seven star catch midnight madness way br br long live leon,1
movie going review little television movie made starred melissa joan hart daniel baldwin br br main protagonist antagonist jennifer stanton hart typical american teenager feeling pressure controlling father baldwin however meet ex con called nick ryan jeremy jordan never kissed instantly fall jennifer different idea take relationship manipulates kill parent protect love used get rid parent brad david lascher future sabrina cast mate hart melissa joan hart actually really surprised role evil manipulator carry movie well using friend nick literally get away murder rest supporting cast work well hold screen time also found interesting film made released year hart began portrayed sabrina teenage witch show act genre film television br br although film dated somewhat still stand best work involves drama thriller looking forward nine dead come november show seen people called clarissa darling sabrina spellman br br recommend film anyone fan melissa joan hart sabrina watch internet suggest check,1
like film several reason soft spot film intricately plotted criminal plot like topkapi also enjoy film like topkapi big deal madonna street spoof genre one best one disorganized crime br br corbin bernsen met four con year decides useful bank robbery planning small montana town given detail crime fellow really know shortly sends bernsen arrested two new jersey policeman ed neill daniel roebuck escaped warrant bring back custody four con fred gwynne lou diamond philip ruben blade rus show without clue except bernsen planning something br br first twenty minute film deal four con slowly getting used gwynne philip managing push away suspicion figure trust time see bernsen patiently waiting right moment escape neill roebuck difficult brightest bulb ever existed result two set plot keep juxtaposing throughout film four con trying figure bernsen scheme put operation bernsen trying maintain freedom pursuer regain cabin hopefully find gang take command also third smaller plot involving growing annoyance anger local sheriff hoyt axton idiot new jersey keep getting hair br br many delightful moment film axton egged neil roebuck surrounding house town bernsen supposed hiding inside yelling megaphone come surrounded scene switch huge montana plain bernsen struggling stumbling mile police think moment moment misadventure four con fortunately put oldest gwynne leadership position always guarantee anything one point car start thumb ride truck unfortunately truck carrying manure br br conclusion gang successfully carrying robbery including disabling police car critical time philip specialty car also gem timing suspense comic result film entertaining certainly worth watching,1
well know rob zombie stole title house corps crapfest rest peace nothing somnambulant performance trite script would raise dead house seven corps groovie ghoulie come plot ha anyway kill bloody amateur making low rent horror flick former abode hell house sorry remember actual name residence bunch mysterious unexplained death took place long ago like arthritic lurch stand john carradine whose small role provides film worthwhile moment attribute supernatural bellowing film director john ireland dismisses superstitious hokum result come across like satan school girl catchy title made tv production value intriguing plot crossed child play dead thing low rent movie low rent movie maker wake dead trouble nowhere near entertaining fun house seven corps dead frame one spends rest minute going rigor mortis dragging u along every aching second,0
know want escavate moon real geneve debated project could lead make possible time machine say movie based fact future time movie scientifical project real hope moon exist happen movie movie saw original movie also read book book like though movie yes totally agree previous comment movie depressing unlike one good force one paralled future good movie,0
tried watch adaptation awful torture like performance quite sub par exception ariel fonda way top role handled subtlety studied shakespeare seen many adaptation far worst one ever seen wonder earth someone made film shakespeare beautifully adapted many case one must watch film may suggest drinking game take drink every time go book original idea two drink every time fonda overacts quite drunk short time,0
winter approach state owned broadcaster abc decided reason partial jane austen festival sunday night commenced twelve year old movie length version emma last sunday recent version three novel persuasion northanger abbey mansfield park come br br curious thing production e television network script ever reliable andrew davy appeared almost simultaneously two much bigger budget movie version one starring gwyneth paltrow clueless modernized version starring alicia silverstone transported plot beverly hill perhaps result even kate beckinsale lead production sank without trace br br general rule much lost novel shrunk fit feature movie length adaptation one tends enjoy remember adequate room develop story character outstanding example brideshead revisited minute episode back compare ordinary movie length version pride prejudice brilliant six part tv mini series novel filmed page page novel often good one adapt wonderfully film atonement recent example novel jane austen sort need time space exert full charm br br given shortcoming type adaptation production ok kate beckinsale give emma right mix self assuredness vulnerability mark strong forthright mr knightly reminded jane tended recycle character  knightly articulate version moody mr darcy p p samantha morton rather limp harriet prunella scale got blabbermouth miss bates perfectly  sybil fawlty speed bernard hepton emma feeble father also excellent saw damp countryside mud poverty well posh interior case anyone thought particularly idyllic age everybody br br even though condensed adaptation oddly slow place  conversation rather stilted even allowing formality time look film sure might due use reaction shot br br like filmed period stuff perfectly nice example compare well paltrow version anyway come,1
already year eddie murphy longer hot started making movie soon would forgotten funnily enough also year murphy directed first film also would first last experiment harlem night exactly call success even great see two best black comedian together namely murphy richard pryor blame actor played role like expected even face typical murphy laugh worst thing harlem night scenario terrible decor everything set roaring twenty everybody profit forbidden club sugar ray pryor adopted son quickie murphy gathering easily dollar per day course soon mob corrupt police come around corner claim part cookie sugar quickie guy give money free plan watch harlem night sure puke moment hear name murphy better avoid movie nothing lame excuse see good joke,0
probably one film many commented undiscovered probably one masterpiece spanish cinema like buñuel master piece day could better visitation others film long time ago could midnight cowboy could also le amants du pont neuf realistic non spot look realistic trainspotting hard story place humour love obviously dramatic sense new social spanish cinema little diamond could resurrection italian neo realism mixed whit best ken loach film br br probably better film discover last year,1
