review,sentiment
monkees surprisingly big favorite mine yes might original manufactured rock band gimmick certainly reached overkill st century however music hold best offer last train clarksville daydream believer believer stepping stone valleri pleasant valley sunday great song written good songwriter boyce hart neil diamond goffen king john stewart great musician songwriter likable screen presence plenty appeal stuff actually decent v show dated stuff still watch show occasion time capsule life magical dangerous time u history br br however know portent thing come like kelly clarkson monkees want considered manufactured puppet recording company despite average talent wanted write song produce album call shot came tour sadly turned disaster especially peter tork choice jimi hendrix opening act nixed due stealing show heavy sexual suggestion music compared monkees g rated content br br however final nail coffin monkees infamous motion picture head head written bob rafelson jack nicholson allegedly high mary jane film received poor review made box office today film cult classic ahead time delivers message mind youth summer anger br br head really plot basically one four monkees lurch scene scene without rhyme reason go eating diner seeing davy jones getting bashed sonny liston western sucked vacuum performing concert forth film basically offer oblique opinion wrong american society monkees bash commercialism war vietnam american policy censorship establishment greed read line see target derision br br monkees spend lot time boxed certain junction film symbolizing felt record company saw nothing toy play time record another hit album scene outnumbered western scene could symbol session musician songwriter record producer whatnot controlled career cannon fire way saying begone br br film truly psychedelic trip behold flashy tie dye color hypnotic concert belly dancing scene druggy imagery everywhere acting actually good biased like monkees v show small soundtrack feature porpoise song three song written monkees br br film actually hilarious scene occasion although maybe supposed mickey dolenz beating coke machine give soda violent punch ups boxing scene mean wiry guy probably weighed laughing br br movie absolute must see monkees fan think lot people feel movie indeed head obsessed society time find great time capsule,1
movie really hoping idea make hashed together ineptitude first avp yet horror requiem far worse could imagined br br hope opening moment film inside predator ship almost breathed sigh relief finally saw predator home world throwaway digital matte painting still nice finally see course human poorly written character referred introduced br br one must wonder seems impossible fox make good film alien predator least supposed filmmaker could done homework br br character set manner would expect worst friday th sequel pizza delivery scene cringe inducing every scene character interaction followed bimbo teen non actor make real film make cheap flick alien predator movie good produced concept remember st alien b movie done movie strause brother really missed opportunity could rectified simply knowing alien predator root alien predator film introduced character part larger group alien refinery worker alien marine alien convict predator film generally follow main hero part unit predator arnold special force predator danny glover police easy see filmmaker franchise started go wrong alien ressurrection pirate something avp explorer gun course avp r teen slasher clichés identify concept idea convict returning small town war vet returning seemed set first blood type action hero like many thing never paid br br film making equally devoid rhyme reason sense forward momentum action small sequence build minuscule level tension interest cut away getting interesting taking audience movie every turn action scene though much ballyhooed trailer darkly lit literally impossible tell going fight scene finally occur basically movie hindered many level bad actor combined poor direction atrocious screenplay screenwriter noticed seemed hit every wrong note cliché untalented writer devoid idea could hashed together writing called even direct video quality demonstrate shred respect established lore previous entry series predalien sudden ability shoot alien embryo pregnant woman throat use incubator chestbursters likely brain dead screenwriter needed way alien predator fight given accelerated growth time even first avp quickly possible must meaningless small talk cardboard cutout stick meaning supposed character substitute real character development remember character defined say sheriff leading civilian cache gun officer law bimbo people know predalien wait predator slowly remove mask attack alien still falling nasty series post alien habit hissing time let prey know run earth series devolve character saying people dying need gun writer even work beyond reflects badly fox already destroyed artistic reputation like everyone involved making film suffered mental impairment really inept every level film making process br br effect pretty lousy time around alien look like men suit adi getting lazy creature design alien look like modified leftover alien resurrection bulky musculature around arm learn movie good design good one recycle everything shrouded state darkness create mystery atmosphere simply hide bad creature look like avp stan winston sorely missed fake looking predator face revealed br br many fault list say waste money movie fox beyond caring fan cheap trashy film clearly evidence felt bad taken girlfriend see though free apologized profusely one die hard fan done franchise br br note fox really wanted mindless slasher flick film adaptation original darkhorse comicbook better anything produced franchise post br br signing,0
astonishing people saw art saw poorly filmed shaky hand held camera generally badly acted unscripted mess seemed like high school film project kid experimenting black white film making injecting mound poetry place story art film make watched theatre people starting fit giggle u included endless stupidity self indulgent meandering mess believe seem endless finished candy popcorn would walked theatre two dozen people packed left looking something interesting,0
movie full pseudo deep thoughtfulness cloying writerly ness includes canned ham voice unbelievable dialogue dialogue tinny tone deaf way spike sometimes always writing certain character like nonsense film like piece april one hour photo another one br br said comment nothing ryan gosling shown awesome chop believer film prof movie director medium movie rotten fair say fault lie actor,0
course plot script especially casting strong film many fine thing see one aspect liked especially idea antagonist luzhini turturro ex mentor working evil sideline chess opponent italian dandy three piece cane turn real gent truly fine chess player credit opponent nobly go along plan end complete final game championship posthumously luzhin taken flyer window sad releasing way unstable genius widow emily watson death gallantry honorable chess master luzhin defence worked late moment lucidity allowed played italian gent commends play call brilliant talk dramatic end game,1
little old show first came first young child child show sesame street watch learned much else cousin born year year first one came latter barney big part watched first saw show told grandmother teach anything us magic fix everything time many year old idea really going tv show saw heard teaching barney told people bad show funny thing parent young child mid late way agreed said thing sad thing cousin older still agree saw cheating creative right think differently someone tell k steal person wont find mind gone let honest barney make money teach child anything flashy program inclined child watching child stupid educated know better second barney put show parent bought never believed tv could affect people way barney young child read watch show teach number let get involved show barney like smoking much smoke hooked let kid watch show hooked one day kid watch crap buy crap bought,0
two year ago sundance loved josh kornbluth directing debut haiku tunnel looking forward brother frequent collaborator jacob best thief world drama seemingly good kid growing lower class area new york movie without poignant moment time kornbluth working way hard state obvious life difficult people life fair br br subtle important understanding despite somewhat abhorrent cultural underpinnings anti social behavior may spawn character shortage goodness humanity recoil language living condition cannot discount intent fact struggle maintain family adversity certain nobility u barely appreciate kornbluth grew neighborhood compassion people evident throughout br br said best thief world suffers many painful flaw including title character believable writing uneven plot line barely discernible many disturbing kornbluth us two young black boy mimicking gangsta rap scene question potential realism phenomenon pain see year old child mf ing talking sex line woman unnecessary shock value forced bit borrowed interest,0
enjoyed every moment beautiful film intrigued female painter never heard set exploring life work afterwards could expected found film exactly historically accurate little astounded however negative comment film inaccuracy come guy film biography novel historical film distorts reality work art right film director fully entitled use element reality history create world artemisia wonderful film think brought many people including give negative comment explore life work fascinating artist,1
hell saw matrix amazed spectacular movie ever made ever possesed wachowski brother film beyond br br plot argue basically film load talking get wrong problem talky film talking matrix reloaded pointless load drivvle would fight sequence lasted way long pointless drivvle another fight scene last long build biggest anti climax ever little bearded bloke talking load uncomprehensible bull minute br br also keanu reef give worst performance yet knew good actor beyond joke watch film order would seem got gradually worse went along god know performance like something gotta give keanu reef plank wood ever become actor br br splendor first film came massive dissapointment already seen first film suggest watch waste time utter pile turd br br,0
love umberto lenzi cop movie rome armed teeth favorite desert commando pretty much legitimized italian euro war phenomenon managing actually pretty good movie give gun machine guy run around talking tough hard miss br br shame encounter eaten alive cannibal ferox could anybody really one watch sense contract told kind film make assigned cast crew given budget deadline script lenzi went executed film way guy mcdonald fix batch french fry two eaten alive original kind amazing considering feature extensive footage copped three cannibal movie easier enjoy cannibal ferox though much br br let others outline plot fascinated film staged look yet somewhat infamous reputation film sort assault good taste though film exercise bad taste complete title earning scene two pretty supporting lady quite literally sliced eaten alive cannibal film high point problem lenzi let u get good long look cannibal feast scene convincing ring rd season star trek episode complete fake jungle set really gory close shot know anyone else someone slicing piece person eating lie look distressed br br problem film might lot respect lenzi filmmaker could directed anybody cannibal movie convention touched never feel like filmed real conviction try bully ruggero deodato sandbox two director certainly must known either sort juvenile rivalry actual dislike work conscious need upstage lenzi invented cannibal genre man deep river deodato blew away jungle holocaust lenzi fired back eaten alive deodato blew everyone else away superior cannibal holocaust lenzi fired last parting salvo cannibal ferox realistic krazy glu commercial guy superglues hardhat girder hang midair br br film less desperate bit hesitant push viewer abyss everything holy ferox remains sort misguided attempt upstage cannibal holocaust one mish mash interesting jungle adventure crossed jim jones like suicide cult cannibal seem like added afterthought rather reason making film think fan genre better impression film fan lenzi film looking something new formidable director entertaining slave cannibal god adventurous man deep river certainly lack wallop cannibal holocaust combine consideration recycled footage stomach churning scene animal violence misogynistic scene sexual violence stagy wooden methodology film making get end ok jungle thriller two three standout scene umberto lenzi capable much br br gore freak go nut however,0
many level good fact considering low budget british indie first time feature director largely neophyte cast magnificent achievement know much cost figure £ bandied publicity never know reliable figure like point film look like cost couple million quid clearly cost tiny fraction great special effect terrific production design effective prop costume excellent photography good acting direction impressive score absolutely stunning sound mix even said much script great character clearly identified something movie ten men dressed roughly one location would easy nameless faceless blank ten character mostly done dialogue way reacted thing throughout middle act plot developing script told story well showed affected character whole film like second act would stunning br br ship blow twelve people make individual escape pod e pod blast away ship much automatic metal coffin poor sod inside trapped cramped real idea going make sense like e pod excellent idea done well make sense nice roomy escape capsule also like way specifically told later designed ship ship escape make planetfall emergency let face guy bloody lucky ship blown close planet said look like unused e pod still freighter wonder prisoner able get e pod get occurred captain gone ship rather first guy anyway e pod land barren planet nothing sand sparse vegetation least sandy sparsely vegetated part planet may icy waste lush jungle elsewhere nah planet sci fi movie exactly accept e pod come within mile ten survivor able meet firing flare sky locate br br captain muscular mountain man could pretty good career action flick get right agent decides try contact captain behan intending rendezvous cannot planet need get orbit engineer say combine power unit two e pod probably give one enough juice lift anti grav doodad high enough blast atmosphere done automatic need pilot send signal captain valiantly volunteer commendably sensible move engineer point putting heaviest man somewhat dodgily repaired e pod ridiculous need lightest member team kid really liked way point name david captain start using treating dignity respect good storytelling good characterisation,1
uzak turkish film shown u distant br br directed produced written filmed nuri bilge br br ceylan br br movie gritty somber version clash city mouse mahmut played muzaffer özdemir country mouse yusuf played emin toprak br br men superb actor plot allows demonstrate acting skill tragically emin toprak died automobile accident shortly movie completed br br country cousin city cousin tale contrast rural urban life style portrayed humorous fashion film little humor even warmth men br br lost touch human society mahmut work br br commercial photographer tile company give satisfaction divorced woman clearly br br still love satisfying human relationship br br mahmut lost job factory closing small town skill energy find work city human interaction primarily confined silent observation people cross path clearly warm caring person express quality urban environment br br cousin relate well world relate well neither make effort act way would provide opportunity bonding closeness br br sense film portrays opportunity wasted br br conceivably cousin could provided least part lacking life instead steer parallel unhappy course two men distant throughout situation suggested film title br br one friend mentioned masterful way ceylan build detail upon detail detail ultimately tell u character might learned simple exposition br br uzak shown part rochester labor film series labor film traditional sense genre labor film demonstrates harmful effect unsatisfying work mahmut unemployment yusuf br br quiet absorbing dark film although make happy viewing walked br br theater realizing seen truly creative br br important movie film worth finding seeing,1
wish would read review opinion movie rented waste money waste time little dialog dialog hard understand every way storyline plot weak thing nice cinematography br br character interesting time spend much time trying figure thing lack dialog rewinding movie lot br br watch movie mess leave feeling like mess br br say heck movie end,0
blue ribbon banner star stripe forever decorated general unconditional surrender enemy required ton ton radiation summon substance united state victory world war ii celebration time square well everywhere else united state suggests national zenith america top right one thing one agonizing painstakingly perverse thing period adjustment actual celebration ended bottle champagne finished everyone need get life one problem though get new life old life gone forever polite pleasant smile fragile facade longevity ice cube boiling water everyone character movie paraded primal doubt unable masquerade pretense nothing seriously wrong simple reason true sergeant general wife daughter son virtually american touched world war ii exposed disability nightmare recrimination world war ii really accomplished well negated nobody social moral issue self serving interest frederick march myrna loy start dana andrew realized never married virginia mayo first place theresa wright become painfully aware fact constructively selfish la least character homer get married think everyone around devastated injury basically sense unable unwilling cope br br reason film fabulous happy ending attained hard way everybody recognized new beginning new united state new world overall tragedy wwii recognized thing emotionally torn asunder taken stride dealt accordingly frederick march myrna loy need go back chapter one marriage homer apprised new bride take married e half time feel like nurse thresa wright involvement dana andrew mean entrance adulthood resulted partial responsibility breaking marriage tantamount learning drive car get driver license indianapolis character movie typical post wwii american stalemated rude awakening coercive change life happiness longer afforded luxury adjective cop aesthetic formidable condition good winning evil way less ugly choice world war ii happen henceforth dominate social pattern american living br br aggregate catastrophe world war ii mirrored american feeling personal human inadequacy well loved film afi probably reason brought issue one time unjustifiably taboo bottom line see movie nightmare combat dilemma marital unhappiness readjustment coping life stricken ed disability basically acting human portrayed constantly movie television today however new american remember director william wyler illustrated american feel aftermath wwii day movie industry left one hand tied behind back take account probably realize sensational movie really,1
honest yall junior high school sitcom first aired abc think would like john ritter felt little potential plus something else liked acting great lot horrible nd rated comedy line john ritter always brings game come comedy great show watch tell great show father never watch sitcom watch movie sport law order actually sat brother sister mother watched show think john ritter honestly think show would still running john ritter god rest soul wish passed away,1
hoppity go town discovers nothing bad news little insect neighbor lowland honest good natured grasshopper save sweetheart miss honey bee machination evil c bagley beetle also lead friend safe new home late br br one great animated feature new art time film created hoppity enjoyable film bring pleasure uncritical viewer technically well made animation generally high quality movie main drawback none character really heart come alive screen way jiminy cricket year earlier pinocchio br br however ultimately unfair compare fleischer studio output disney max dave fleischer star follow contribution would considerable one would realm one reel cartoon popeye betty boop series created alternate reality viable produced cartoon studio hoppity second experiment feature length animation gulliver travel henceforth would expend energy cartoon short subject fact first highly acclaimed superman series already release br br hoppity story owes great deal frank capra energetic go get em hero powerful societal force indeed film original title mr bug go town immediately put one mind gary cooper jimmy stewart capraesque adventure br br jack mercer famous voice popeye speaks two different character old mr bumble swat fly movie maven able catch veteran voice actor pinto colvig mae questel uncredited role br br film pleasant song supplied hoagy carmichael frank loesser little baby bumble bee familiar couple castle fine romantic tune deserves rediscovered br br unfortunate film initial animation sweep heaven past depth new york skyline obscured behind opening credit,1
first minute movie make fun sequel pg movie reason movie bad constantly reference movie called get leo movie movie version get shorty every time really angry travolta cool neither keitel however rock vince vaughn hilarious kind funny would expect see elmore leonard movie though seen get shorty probably like cool liked get shorty leave theater wanting kill director screenwriter wait dvd,0
someone like chase scene really intrigued fascinating true life tale optimistic heading film many obstacle got way good story br br bad fan robert duvall many character played role dull one insurance investigator br br dialog insipid pretty kathryn harrold real garbage mouth read several director replacing film bad tell thing right story get involved treat williams portrayal cooper either fascinating movie also kind sad comment guy committing crime sort folk hero admit wound rooting guy br br everything disappointing complain scenery lush green forest oregon desert arizona br br like see movie made done better one kind story,0
add much said already except going line minimum policy br br actually got vhs dvd copy quality quite poor desperately need officially released br br imagine extra would like see tim healy character swearing way one football blooper type programme would great imagine course look like people carry dreaming dvd release br br surely god must someone dvd release department itv also know something british culture web savvy enough look imdb oh well,1
stan laurel became smaller half time greatest comedy team laboured contract broncho billy anderson series cheapies many parody major hollywood feature laurel parody film mildly funny even less funny modern audience seen original movie laurel parodying fortunately mud sand lampoon movie still well known blood sand starring rudolph valentino blood sand released nine week parody giving idea quickly broncho billy movie ground edited distributed br br various source including imdb state stan laurel character film named rhubarb vaselino final screened print mud sand original title hobo type font report laurel role actually cried rhubarb vaseline e agree vaselino funnier laurel copy elaborate sideburn valentino wore blood sand made longer parody valentino dressing scene movie made female movie goer swoon señorita named carmen original film parodied caramel girl like sink teeth br br movie like original apparently take place spain yet prohibition gag laurel us distinctive hat tipping gesture could become trademark like hardy distinctive necktie twiddle never spotted laurel film amusing dialogue rhubarb vaseline tell matador save bull vaseline becomes successful toreador lackey tell bull without sir funny disappointed laurel reply without br br one funny moment almost certainly planned vaseline show bullfighter audition laurel swagger bullring say corrida querida toss bull fence land thump near auditioners bull obviously fake gag funny anyway aye title card joke throwing bull serendipitous moment occurs laurel repeat gag vaseline sling second bull fence one land butt balance upright instant toppling funny somebody planned gag quickie comedy salute unknown gagsmith tech man rigged bull land position likely happened luck director editor smart enough keep br br silent era whenever hollywood made big budget feature film set anyplace people speak english common cinematic device show piece text inscription local lingo dissolve shot text english surprised low budget comedy spent money copy device see notice board outside corrida message spanish dissolve text english unfortunately photography cheapo movie dark effect wasted br br actress movie attractive including broncho billy wife leona anderson stan laurel common law wife mae dahlberg latter briefly pretty dance mae danced stan vaudeville act surprised spot charlie chaplin half brother wheeler dryden brief role since chaplin nothing movie mud sand laurel give funny performance quite unlike later familiar stanley character film much less funny brilliant work oliver hardy rating trivia note twenty three year later stan laurel last american film bullfighter played spanish bullfighter spanish voice post dubbed coincidentally film used stock footage blood sand valentino movie tyrone power remake mud sand funnier bullfighter much,0
