review,sentiment
well eyeboy must say pleases end someone single try make fun especially someone seems intelligent favorite part post big bang bang good guy bad guy kimosabe suggest stick movie lotsa bang bang br br well said like action movie especially well done also like movie whole lot action long well done sorry secret lie fit category simply bad movie really see many non american film maybe spoiled realize bad foreign film really saw secret lie perhaps judge foreign movie different standard could day see secret lie could possibly one highest rated movie imdb hmm true scary br br jeremy barger bit midohio net new e mail,0
brought philip larkin life way worthy greatest performance time one measured popularity show stark portrayal larkins life greatest unrecognized poet era exactly would wanted disdain canker medallion dramatically expose raw beauty intense sadness philip observation relationship mortality lay way seems missed even great philosopher anyone interested profound observation relationship life love death must,1
name frau main character german word woman know intentional sure got giggle german audience fantasy film festival last year shown br br giggle movie got aiming giggle horrible movie heaven sake horrible movie one meaning shame premise like wasted horrible even unbearable moment viewer definetely faint heart even necessary show thing shown even going moral obligation movie really kind task function discussion shown new low whole torture movement grown last year,0
nothing outta star another weird premise director movie cube time around two main character find home transported mysterious white void literally nothing outside small two story house intriguing sure thought comedic tone established movie get go extremely ill conceived need humour certainly problem humour eventually derived plight two hero final showdown definitely hoot really think movie would lot better stayed rooted reality beginning watching movie watched making feature dvd short trailer end almost totally devoid sillier comedic aspect making look like completely different slightly better movie last half hour movie thing really start come together similar way recent movie primer actor fine overdoing comedy shtick really quite believable normal moment probably ready write movie failed experiment midway point end keep watching past credit final scene ask explain,1
nothing director juvenile fantasy come life movie nothing excuse director actor play kissy face attractive young woman would otherwise never give time day br br plot simple direction nonexistent movie drag actor director writer narrator narrates fooled x rating nudity minimal gore,0
sir played lear time tonight remember opening line sitting mirror eye reflect king madness dresser prompt gently mouthing word air desperation men great actor knowing power slipping away valet cum major domo cum conscience cum surrogate wife aware bos decline madness knowing powerless ease passing dresser really love story two year become mutually dependent one another extent neither conceive future without set second world war concern fortune frankly second rate touring shakespearean company comprising equal number beens wannabe led sir theatrical knight might kindly called old school whatever part playing grab centre stage bellow footlights bullying audience applause somewhere inside buried time deep beneath ham regularly dish still remains occasional glitter earlier greatness catch glimpse audience fervently hope mr finney cleverly concentrate ham often point caricature ready dismiss performance mere hyperbole bluster produce moment exquisite subtlety vulnerability make realise great actor playing great actor go mr courtenay easy write portrayal br br norman exercise stereotyping middle aged effeminate rather camp theatrical dresser sashaying way life enjoying company girl loving wicked insider gossip rife theatre strongly suspect still many men like norman profession infinitely kind patient knowing play many actor run backstage wisdom affection believe vast majority would hoot approving laughter mr courtenay portrait saw dresser london stage perceived wisdom mr courtenay norman rather subdued movie sir played great mr freddie jones huge acclaim audience memorable performance overshadowed mr courtenay reducing rather also ran opposed actor level billing idea sir norman might almost incomplete without went right window norman reduced puppet sure ronald harwood intended made breathtaking theatre messrs finney courtenay redress balance movie restoring equality relationship men come long way since early appearance british new wave picture became darling vaguely leftish middle class ashamed movement british cinema virtually committed hari kiri quietly concentrated theatre apart role keep wolf door renaissance substantial movie appeared blinking unaccustomed bright light br br dresser marked return still fizzing energy talent shouting world large still big movie assuredly great one,1
think time seagal go quietly night seen make direct video release last year look like early smash hit comparison br br secret bio lab making new kind drug jack human adrenaline system point become psychopathic killer something somehow seagal supposed stop infection end world something seagal also went hit squad like jellybeans every time look commanding new face kinda got hard follow character development well know steven athsma prevent yelling top lung even constantly dubbed people sound nothing like usually film plot action sequence save total waste time even close like said horror movie lot blood shank stabbing rather straight fighting problem really scary seagal looked completely place infected people supposed speed light movement yet year old lb seagal killed singlehandedly guess lone highlight movie first minute new recruit ask seagal come strip club br br,0
watched tenant interpreted horror movie us many trope genre sinister apartment suspicious neighbor apparition mystery hallucination life hero trelkovsky seemed surrounded evil secret force trying drive mad br br last time watched challenged initial interpretation movie horror movie horror sense kafka novel horror fact movie understood literal level lonely man slowly becoming crazy without external influence br br polanski made career three movie dealing madness repulsion particularly like development madness heroine never convinced rosemary baby heroine driven mad evil force tenant might best study paranoia ever made cinema br br trelkovsky young man rent apartment woman killed becomes obsessed slowly start becoming wear clothes put makeup talk like possessed spirit letting wild imagination get best hesitation real imaginary polanski never resolve make fascinating movie many event movie attributed supernatural easily normal cause viewer decide believe br br although favorite polanski movie nevertheless good example ability create suspense portray madness convincing term technically speaking marvel suffice say collaborates film composer philippe sarde legendary director photography sven nykvist bergman dp making movie slow pacing sometimes uninteresting segment may make movie difficult enjoy experience nevertheless,1
waterdance main character waterdance played eric stoltz find rehab center others similarly injured must face harsh new life confined wheelchair interesting promising premise unfortunately fails deploy ensues instead largely hollywood schmaltz interesting moment certainly cast eric stoltz william forsythe wesley snipe et al brilliant perform well one would expect talent wasted character mainly stereotype one kind another thoroughly unlikeable snipe character exception suppose kind attempt break people idea handicapped crippled weak depicting part face prick make entirely annoying experience admittedly show something permanent disability go way softened romanticized useful good idea process depicted make one difficult person get along worth dealing part parcel character must varying degree despicable disneyfied either surely middle ground somewhere film conclusion eric stoltz character come accept status handicapped person since flaming narcissistic monster beginning film end care less br br addition character problem film suffers weird syndrome many hollywood movie suffer syndrome really official name might call inexplicable forgiveness syndrome go something like character abuse crap without much apology forgiven especially obnoxious example movie breakfast club one character spends film verbally bullying everybody within earshot result love one latest example spiderman supervillain sandman lay waste chunk manhattan wail spiderman seems like monotonous minute waved amount bye egregious example ifs waterdance sequence called n word william forsythe racist biker character friend previous scene wesley snipe character whoop forsythe character next scene nothing happened short time hence without much oh yeah sorry business back know called n word make wonder people actually watch movie release film eye closed kind slap together editing room according scene number call day work,0
say one redeeming speck regard film firmly establishes bottom barrel filmmaker know aim making movie regret watching debacle shameless abandon making film waste right folk one hundred thousand dollar film reminds adult video award show group industrial prostitute stand praise believing real actor actress filmmaker ironic watched blue movie better acting directing writing also found funny executive producer justin ament movie play deputy jake barker sure acting career taken ted pfiffer writer part doubt wallowing clichéd glory created noted carrie finklea lead role movie might remember gu van sant elephant though sure want write film resume sure depressing point money spent make film people going watch along torque godsend sky captain world tomorrow one worst film worst film,0
anyone argue fact urban cowboy still best document texas life time period consider following men beat wife get drunk bar nightly get married settle fight commit adultery compete mechanical bull try name movie depicts real life vividly dont make anymore seems current film always people lot money live huge home drive expensive car work movie celebration scene getting trailer pete sake br br anyway watch least week kidding dissected movie end end feel free email learn reason calling documentary consider following scene bud see sissy split amicably honk wave flip bird return half peace sign honking horn add impact tear br br bud mom call approx hour get town sunday see job yet accomplished getting drunk laid x help uncle aunt cover br br live like pig think scene needed think necessary could figure without showing filthy sink god love br br sissy allows wes help ride bull day possibly next day wes kicked crap husband steve asks hey sissy remember wes oh yeah didnt beat husband night let get lesson goin make mention fact seek solace later one bud sissy many fight way take place public gilley br br wedding reception picture taking session oh humanity could least arrange move chair way leg sweatin momma br br conclusion put scene like movie try show insight human psychology documentary real life br br wish director cut,1
watched movie gotta say great premise great talent turkey lay friend lent movie watched open mind mainly high praise story br br well movie started kevin costner fighter pilot retiring make fighter pilot supposedly going hired anthony quinn character new pilot well never see costner go near plane rest movie br br costner run texan james gammon selling horse big mexican businessman costner tag along ride without knowing happened gammon beat near death costner drive meeting happens associate quinn nothing come nada zilcho gammon character horse sale quinn associate nothing come br br also leave costner dead make madeline stowe character become whore attack one quinn men paying turn stab knife next thing moved convent explanation moved done br br much talent wasted weak script poor editing watched friend owned let watch going throw hour wasted life watching blasted thing,0
love sarah water fingersmith worried tv adaptation disappointed bbc version tipping velvet although beautiful look let keeley hawes able sing rachael stirling able act fingersmith tightly plotted novel breath taking twist turn wondered could done justice hour br br worried adaptation excellent little cut went along cracking pace although wonder whether read book would miss thing look feel bbc classic costume drama kept remind contemporary book br br acting stellar sally hawkins acting heart sue trinder elaine cassidy slow burner end story incandescent maud lilley love passion realisation act betrayal would perform written face joy watch br br hope rachael stirling watching play sarah water character,1
first watched show cartoon network found uninteresting read lot good message show decided watch show boring episode predictable show logic hypersmart girl going school sometimes stupid thing episode start monster attacking townswille mayor real fool funny stupid imagine became mayor professor yes supposed smartest person show actually even found difference monster brother narrator comment also make show boring also similar line beginning episode ending also animation strange everything except main hero shown ugly way also every epsode show giving life lesson mean oriented little child look closer see lot violence even blood battle,0
nice see julie andrew trying straight dramatic role something done awhile character judith wise try pas judy old refined manner tomboyish hairstyle yore andrew enacts grown actress would interpret frigid surprisingly bland drama set barbados involving omar sharif liveliest leading man around even hoping make andrew spy also slowly leading proverbial bedroom unmemorable outing camp value james bond like credit beginning cheesy hoot julie quiet contemplative much audience film blake edward pace freakin thing like funeral,0
named everybody love sebastian rural go nowhere town high school junior senior seemed flip flop one weird hair leo like good look big plate full issue step dad announces definite plan sex change operation upon mom call marriage quits sebastian called f word everyone mother kissing around various girl getting high ready whip supermarket saving strawberry prostitute clutch ruthless pimp br br sebastian buddy make eddie haskal look like choir boy bad association get much worse sebastian seems go harold suicide attempt record although admit suicidal tendanccies apparent reason genius level sat scoring sebastian must graduate year early although clue future want attend college give nonsense br br film look week life someone pretty messed final scene suggests thing alright although left entirely viewer br br maker film seem bank solely undisputed appeal attractive male lead story leaf lot desired looking gorgeous kid next exactly satisfy lackluster production value measure film independent otherwise low budget weak story need pretty face carry result project forgettable insult intelligent cinema fan,0
funny one day seen movie watching documentary leni riefenstahl comparison kind came automatically course br br movie weak every aspect acting convincing especially one play simona unnatural editing confused always leaf taste unfinished shot music fit story flow get boring movie come much longer oh character well shown actually tell much girl except see movie also try shock explicit cursing laughable br br,0
soldier great movie everyone hated plenty good reason liked soldier alot partly expectation low saw surprised br br first art direction tight well executed far science fiction backdrop go soldier thing design genre set costume prop consistent competently executed love future military style impressed effort made movie worth time took watch br br second kurt russell fan grew watching guy memorable movie youth barefoot executive john carpenter film soldier essentially action movie role sergeant todd essential action hero award winning role kurt muster convincing emotion little dialog br br third fight scene battle well choreographed iron monkey even matrix far exceeds average level quality genre br br seen like sci fi action film pick pas rental depot choice expect next bladerunner,1
remember worst film watched total waste actor audience time prefer sitting tv think film right film maybe film recorded make people believe moscow mystique past must say expect anything else rade serbedzija expected vincent gallo film lack plot character development denouement entire movie underground tunnel mystique must fair camera effect even poor picture total waste time,0
jack webb riveting marine corp drill instructor webb play sgt jim moore tough fair marine whose job prepare young teen possible combat one could played role better jack webb former marine assure accurate film dealing basic training corp extremely entertaining,1
ok chuck norris shown many entertaining movie year one even bother trying get plot bible shipment gone wrong acting main character wood like pinocchio would done better job synthesizer based soundtrack even worse one deathstalker whereas traditionally low budget spooky movie often trying catch audience adding plenty graphic violence one trying catch audience throwing religious mambo jumbo spectator plot boil different version bible,0
love chan wook park know expect film brutal poetic tragic artistic splash grim humor thirst clearly park style loved every second cinematography every shot gorgeous creative story blend shakespearean tragedy murderous love gothic horror layered character drama character complex plenty moral ambiguity go around even sociopathic character evokes sympathy direction restrained performance nuanced like sympathy mr vengeance many subtlety take first viewing chan wook park intelligent bold consistently surprising filmmaker unpredictable scene go brutal heart wrenching laugh loud hilarious instant closer lady vengeance sympathy mr vengeance far top comical like lady vengeance incredibly rich thought provoking rewarding br br like beautifully told vampire story let right one fan chan wook park seeing thirst obvious easily one best film,1
hard believe awful reality show past year one take top spot worst one yet still wondering actually spoof done sctv gang andy kaufmann still alive sure behind rock band stoop lower inxs shameful thing premise simple moronic audition bunch karaoke reject become new lead singer inxs take place michael hutchence committed suicide eight year hit later band commit ultimate act patheticness subjecting auditioning bunch talentless wannabe new lead singer band year past prime trot awful singer thought american idol share doozies atrocious rendition every classic predictable rock song imaginable cut inxs band member seriously discussing merit candidate could see better original rock performer night club city world br br usual uncreative element every reality show lame reality participant lame interview lame host emcee lame judging performance lame booting one participant end show show get predictable clearly publicity stunt part band last gasp hope rekindling lost stardom finally buried oblivion michael hutchence shred dignity alive rolling grave inxs ever great band idea pathetic inxs representative rock roll become show would final proof rock roll dead,0
reminded spinal tap serious level story band reunion tour thing harmonious especially impressed performance bill nighy ray felt sorry yet certain creepiness great movie watch ever seen favorite band get wrinkly old pathetic bittersweet highly recommended,1
spoiler alert throughout australia summer turned deluge rain hail stone size baseball causing havoc coastal city like sydney hectic condition tax lawyer david burton richard chamberlain got involved case defense attorney involving death local aborigine found dead outside sydney bar br br five fellow aborigine arrested billy cormans athol compton death determined police coroner billy died drowning violence even though bruise neck shoulder yet court decided prosecute five death charging manslaughter instead murder br br david defending five get help defense accused assailant opting remain quite keep happened billy take coming court one defendant chris david gulpili begin somehow invades david dream want tell really behind billy death br br david first taking dream chris seriously begin sense real meet courthouse chris confirms david dream showing strange looking black rock david saw chris dream later meeting chris turn aborigine shaman charlie nandjiwarna amagula came house evening david told like charlie spiritual power inherited mother grandfather power reveal future strange weather condition flooding australian continent earth chris tell david going gigantic cleansing cycle old world washed away new world ready take place br br david confused chris charlie telling rain continue increase ocean wave start rise feel something terrible going happen david want know aborigine folklore scientific fact logic behind end world like revelation br br obvious chris charlie member aborigine tribe right heart modern sydney alone get chris well four friend murder billy since australian government prosecute tribal aborigine leaving justice done tribe still chris refuse admit member native tribe four friend convicted manslaughter billy death sentence handed judge within day br br david determined find reason chris silence billy die taken chris scene crime david find billy betrayed chris tribe member going billy member chris aborigine tribe also revealed david kind spiritual connection austrailan aborigine charlie step father rev burton david parslow told br br stage set great final cleansing cycle david seeing night time dream day time vision come form massive tidal wave rolling pacific ocean australian coast city sydney submerges entire continent,1
dragged movie four year ago french actress friend mine br br first half hour sitting uncomfortable seat new beverly theater hollywood hating film hating even hating french actress br br know happened pulled film way year despite fact one projector broke changeover hand theater close four hour worth br br believe great movie pull inside world make part drop talk friend coffee drink film one best filmgoing experience ever br br br br,1
bird plane look disaster need look sky br br ok enough singer tried make romantic titanic like movie crash box office record failed sr structure dark restricted color scheme would call wishi washi boring usual dialog clown advanced alien technology missing fun magic etc make movie completely disappointing br br simply work br br main thing character like superman superhero core important thing br br love trouble sadly lost depressive supersoftie maximal facet long superman movie whole time br br superman superhero movie anymore like case bad boring social study every minute person fly around br br big difference br br movie joke holy skywalker superman give u supervillains superaction important thing superfun br br want entertainment singer want make long soul love trouble drama lost sadly people take normal human character make yentl remake br br say superman return supersadlysoftie stand door br br maybe singer tried kill legend without kryptonite one bad movie give plan sequel br br next time singer warner brother make superhero movie depressive superlame soap let superhero movie mean colorful fantasy lot fun magic br br movie like cheap chocolate box super cover yes technically sort yes lot small talk joke view action scene etc one worse piece common poor quality br br super boring patchwork one worst movie ever seen live br br ridiculous cast strategy cast young possible make sequel next year give rest kate bosworth play year old star reporter looking like superman full five year away slept year ago looking like daily planet reporter wroting spend night superman warner brother much br br routh bad playing little bit wooden whole movie wooden temporary good marsden sometimes posey rest forget even spacey terrain br br reeve hackman kidder acting easy fun difference br br jesus pose end ridiculous hell problem mean serious joke next time spiderman batman ironman fall rise like jesus angel speak god directly superheroes saving human life every day least one talk god every week possible oh god br br maybe real announced movie instead bizarre dull parallel universe br br warner brother superlame depressive flick possibly greatest disaster history money br br understand difficult maybe create transport message feeling showing lone lost sadly people new thousand movie tv show better old new one like magnolia flying frog impressive flying superwoman sorry superman course br br singer wb simply nothing fact even nothing like black hole destroys passion comic superhero movie steal u three hour life br br mr smilla little brother angry green like hulk,0
movie action comedy heroic best finest actor gunga din remain classic enjoyed like good movie excellent picture collection,1
historical movie always take liberty conversation concocted one could actually know said custom adjusted comprehensible modern audience etc however historical film actual historical personage make least minimal nod history film scene actually remember hero surprise assassin creep chamber night confronts dangerous intruder remember sending room service main entertainment value badness recommended local video story put turkey shelf,0
