review,sentiment
early creature feature concern long abandoned gold mine intrepid miner determined check naturally find gold one hungry monster slithers along search prey br br honest admit found dull first personally prefer thematically similar boogens actually grew went along character interesting actor either closest interesting character morgan played keith hurt event female lead terri berland quite good looking rolf theison make domineering jerk easy person hate writer played effect man mark sawicki wear thin quickly br br begin comfortably predictable enough way nighttime set piece two victim claimed get thing acceptable start monster intriguing design imagine get revealed bit time late game product stop motion animation process longer used much director melanie anne phillips directing pseudonym david michael hillman crew deserve credit creation atmosphere manage make film look quite claustrophobic gloomy use lighting work well film build intensity towards pretty good ending suffice say best low budget br br obscure little item worth looking die hard horror buff br br,1
rourke usual bit part sinister rancorous neanderthalian ferocious evil jerk mold picture claire fifty get carter double team rest garbage happens br br line br br course junk undervaluing rourke abasing matter characterization actor still seeing prayer johnny handsome barfly week year dragon etc etc many year considered rourke outstanding smart intelligent man think changed since br br look callous calcined br br went gloomy look despair inhabited breast made man perfect pest belloc example br br absolutely reason watch dull movie except rourke,0
thought movie pretty good part corny understandable since made year ago thought best performance movie given michele morgan played millie convincingly jack haley also really good mike brien even though big frank sinatra fan think good movie craving silly top musical comedy higher higher movie br br,1
want much believe quote specifically english subtitle translation actually written spoken rejection letter publisher sends protagonist meant self referential tongue cheek manner director leo carax apparently neglected inform actor true nature film dreadfully earnest portrayal conclude carax actually take seriously else much disdain everyone especially viewing audience bothered letting anyone joke br br auteur able get away making oblique bizarre film élan unique personal style e g david lynch alejandro jodorowsky others use subtler approach still weaving surreal element fabric story e g krzysztof kieslowski david cronenberg later less bizarre work pola x carax throw disjointed mess viewer dare find fault well pacing erratic choppy particular continuity often dispensed superfluous character abound e g gypsy mother child performance overwrought lighting often poor particularly oft discussed sex scene unconnected scene thrust film discernible reason list go br br completely negative noted uplifting exception liked musical score even cacophonous industrial techno music played sprawling abandoned complex main character retreat second half film perhaps reference andy warhol factory much photography countryside beautiful obvious attempt contrast grimy city setting even well middle age cathering deneuve show still performance also one among major character sink bathos br br earlier time would regard film pola x charitably experimentation admirable even experiment work carax try nothing new film pastiche element borrowed countless earlier film several decade movie viewing literally thousand film later simply longer patience kind unoriginal poorly crafted tripe early moment st century one left asking exception jean pierre jeunet director france know make watchable movie anymore rating,0
movie delicate argument searching something make think right tim robbins made wonderful job result kind docu drama shown school strong theme treated actor well simply great susan sarandon truly face love sean penn unbelievable almost always absolutely must see,1
ridiculous comedy given arm flailing direction love one comment made today well neither could philadelphia story without car chase two nonetheless mean picture worse wear old fashioned think susan slept good generation fester peacefully memory debbie reynolds buff sparkle story screenwriter latch onto much younger girl script research dick powell make farewell screen appearance must embarrassment reynolds pallid produced one harriet parson give famous mother louella number inane plug,0
woody allen best one sharpest pen around make acute observation wrap around punch line like nobody else however worst movie stench pretentiousness unfortunately melinda melinda stench opening closing set one intriguing idea four friend sit restaurant discussing whether essence life comedy drama help settle argument one man relates beginning story asks two men arguing one comic playwright dramatic playwright whether story comedy tragedy two men continue story movie play story weave first heard film understanding tell exact story genre comedy drama change look would interesting however story share one main element side element entirely different story major plot difference drama stiffly scripted pretentious really work self parody point failed element prevent audience feeling emotional investment character comedy story moment success still short fleeting farrell obviously meant stand woody could played character much believably without adding woody stutter hand tick woody best woody someone else try playing character modeling recognizable actor type thing pull audience story br br favorite woody allen movie make leave theater little bit lighter spirit walked one made wish could get money back,0
like title thread say impression got movie marlee matlin character always angry cynical pathetic character first date william hurt character dancing dumb tried finish watching movie four time four time fell asleep would keep watching movie one intention beat problem insomnia put sleep sweet dream,0
voting option compelled use next available figure br br sad day bollywood type movie star cast actor nothing bunch juvenile acting awful script br br movie nowhere near called clone hitch salman khan usual take shirt theme govinda humorous laugh somebody told decade ago would writing comment salman success maine pyar kiya would written,0
broadcast news open series brief vignette clever way starting story tv anchor clue reporting br br speech group would reporter bored presentation leave last one exit co host event say quietly holly hunter think q subtle line brilliantly written low key comedy farce show biz aspect tv anchoring br br william hurt inept news anchor find working holly hunter network anchorman hurt badly need help remedial reporting holly refuse take bait first know capable looking good reporter prof quick study long earpiece working getting straight info executive producer hunter br br holly anchor friend albert brook help feeding information pass hurt course becomes conflicted feeling ace reporter brook equally strong attraction pretty boy anchorman hurt dalliance pretty staff member br br wait twenty minute film end find man end brook tell hurt wrong one represents everything unpredictable comedy telling hunter neurotic heroine end br br fittingly holly hunter william hurt albert brook nominated oscar brook supporting role film director writer james l brook seven well deserved oscar nomination br br script opt conventional happy ending case flaw brilliant screenplay felt cheated somewhat let wistful conclusion,1
thing never understand underwear come pack three clearly thats enough example similarly never understand film brilliant approach film expecting actual movie might well approaching satan expecting hug although may well possible greet film satanic figure take pitch instance ineffectual camp unhellish portrayal devil since freddy mercury wayne sleep joined force create ten foot satan costume red body paint horn covered condom however create hilarious moment film ever seriously understatement applied every character bar little girl act sickly innocent probably overcompensating serious crime part santa inter space recon station real chance could avoided long put simply seen movie cannot consider serious buff achingly funny characterisation acting concept almost radar racism make must see film date pure laughter,1
done quite review imdb film unique never saw entire movie terribly stupid unfunny sit though tried br br biggest problem mel brook movie call mel quotient word better movie less see film think producer young frankenstein great film barely film like life stink space ball chock full mel pretty dopey movie yes like space ball place talk br br second apart cancer rectal itch mental retardation think less funny topic homelessness comedy breaker think folk funniest scene movie mel making whoopee leslie ann warren dumpster funny way,0
okay good best picture please even close munich better capote much better good night good luck much better brokeback mountain well academy voter seem act like current day democrat please little everyone dare take concrete position complete moron office u br br worst aa presentation forget since way hollywood afraid bottom line set straight many voter apparently even see brokeback mountain get real get br br pathetic year since watching mid two br br wake whoever hollywood mainstream happened box office king kong last star war film another batman film make whatever charlie chocolate factory much come br br least original best picture e munich heard one capote great katherine keener even though know reese sing like cash carter etc syriana much better picture crash film done since early make best film horrible oscar night horrible year end another boring year least bafta best picture went brokeback horrible song pathetic think year left america usa someone come change thing bit maybe china since much country india high tech job largest democratic country entire world br br america become land fat pathetic stupid trash found place florida west virgina south dakota mid west br br drive local mcdonald burger king goodness sake order want get heart attack put misery,0
like end day movie like b movie hoping would like movie br br could ignore poor effect often atrocious music cringe inducing line could ignore unexplained event fact movie constantly relies deus ex machina excusable given subject matter could ignore fact people fight hunger try reach world peace bad guy none thing kill movie kill movie plain simple boring nothing actually happens almost scene movie designed push movie creator moral viewer cost actually coherent story kind suspense br br looking entertaining b movie look elsewhere movie boring,0
read book based adaptation bother hated every character show miranda slutty selfish mumbled miserably appalling dialogue sister total wimp worst depiction manic depression ever seen degree psychology accurate fact mentioned realise troy supposed bipolar thought normal slightly grumpy teenager br br saving grace stupid show david tennant whose brilliantly psychotic performance thing got watch second half br br clearly writer producer show done research troy mental problem remotely accurate forensics involved twist ending spot mile big ole dummy br br utter garbage,0
original le visiteurs original hilarious interesting balanced near perfect lv must candidate worst first sequel really good film lv everyone keep shouting gag work first repeated another time vague hope eventually become funny lv horrible parody lv except course parody inventive loved lv see film see lv,0
bad movie entertainment witnessing bad movie bad acting bad production etc aka mystery science theater quality love pacific inferno jim brown forever remembered one greatest football player ever play game actor forever remembered one greatest football player ever play game sure rolf bayer hoping year old directed perhaps may next spielberg making grown man directing year old could done better basis plot movie probably historical merit maybe even truthfully accurate actual film may one worst movie made american film history kept waiting lee marvin william holden charles bronson pop somehow save whatever face left film would loved red carpet black tie gala hollywood opening movie previewed movie many viewer laughing cringing breath dime dvd rack look entertainment value movie bad good pas,0
film absolutely brilliant buzz rush make want go blow wage loose weekend sanitation come together one without care world film layered depth dialogue place spot especially jip character instantly likable one particular obviously dyer character view star war really genius br br ever got hour kill going stick immediately feel growing confidence definitely recommend,1
art house maven dream overrated overpraised overdone pretentious melange deserve best picture merit dwarfed competition start place sun detective story streetcar named desire abbott costello meet invisible man name came better arthouse crapola closing ballet claptrap intellectual crowd place wrong movie actor time less capable acting less charismatic kelly caron worst saw movie among worst best picture oscar winner,0
believe entire book written odyssey remake classic film film loosely based hollywood first started talking enterprise reaction always negative many aspect could gone wrong starting solid ensemble made original unforgettable exactly thing begin souring selection actress otherwise remarkable work suited part sadly enough directed heavy hand director understand appreciate source material br br seems focus direction direction taken obliterate anything good original film called updating let drain story humor snappy dialogue interesting premise let prove woman come long way except problem really get least watching film woman truly going br br starter casting meg ryan central role prof almost fatal movie somehow seems locked sort limbo woman really change appearance even year working movie mary proved difficult role somehow grew interaction stereotype like dorothy wizard oz learning observing realizing choice matter might choice woman would celebrate nowadays fun ride part fun catty silly sometimes slapstick routine elevated movie realm sublime earth thud changing nature sylvia film lost lot spark anyway annette bening fault help admiring tried save sinking ship got sinking feeling struggled horrible line handled thankfully entertained looking terrific outfit kept reminding talented lady really sylvia wise flawed could great creation unfortunately m english paying attention work loses control one character could turned film fresh direction br br yet biggest blasphemy original joan crawford probably one best performance woman crystal legendary conniving line incendiary move duplicitous maneuver sexy pose link male female knew whole catastrophe provided tension men woman dangerous sexy ultimate femme fatale woman intelligence feared admired importantly wanted destroy save heroine eva mendes gorgeous two dimensional outing weak writing bad casting br br atrocity film addition terrible role mensing dedicated mother life baby rather annoying lesbian turn pinkett come biggest waste talent movie bette middler little unrecognizable make show spark could acidic delivery reminds u contemporary angle film could taken word revive put big much needed naughtiness film exciting see could really fly gone film six minute fade away middle muddle br br movie raised anticipation level truly disappointed u film could joined successful sex city made amazing transition big screen respected source material compromise gave u bigger better adaptation truly updated made successful woman present reincarnation need go back rework much like hulk year find suitable performer really good writer someone truly treasure good movie,0
wimpy stuffed shirt armand louque blandly played veteran character actor dean jagger rare lead role join group researcher want find destroy secret technique creating zombie armand fall lovely claire duval fetching blonde dorothy stone us meek sap get armand colleague clifford grayson hopelessly wooden robert noland marry furious used spurned claire armand us knowledge voodoo get revenge sound exciting well sure starter victor halperin static non direction let meandering uneventful talk ridden story plod along excruciatingly slow pace worse yet halperin crucially fails bring tension atmosphere momentum hideously tedious proceeding mostly blah acting largely insipid cast help matter george cleveland hearty general duval e alyn warren irascible dr trevissant manage enliven thing bit welcome refreshing hammy histrionics drippy stock film library score painfully obvious stagebound set crude cinematography pretty lousy unimpressive well fact feeble excuse fright feature crummy even uncredited starkly staring eye great bela lugosi alleviate brain numbing boredom dismally dull dud,0
viva variety unique hybrid program parody tribute program represented br br directly mock classic favorite sonny cher show thomas lennon kerri kenney playing divorced show biz couple somehow forced host program together female pair towering male constant barrage insult humor couple tossed plus sketch comedy bit performance kindly described specialty act br br hybrid mix fact fantasy course mr former mr laupin program announcer johnny bluejeans likewise equally fictional act performed certainly real even entertaining also act would clearly better suited old chuck barris gong show br br show really like extended sketch sctv borne mtv series state would suggest would better five minute bit mix program like one rather stand alone series viva variety certainly get high mark original concept even though often odd funny certainly worthwhile especially road tripped la vega brought even glitzier act perform unlikely ever see anything like television,1
definitely one weaker series carry film lack usual fun sparkle even cast seem embarrassed poor dialogue time came series terminal decline boy show coming fresh series avoid one till near end,0
first saw love limbo playing late free air tv five year ago since movie always remember warmly one film see forever influenced br br uninitiated australian film long history making beat comedy lovable loser love limbo sterling example whilst russel crowe name actor although day movie need rest aussie cast good still steal show nervous nerdy virgin loser though br br general premise lot like american pie group friend wanting get laid become men expect entire movie focusses sub plot lead mother various incident full humorous situation push towards inevitably sweet ending br br enjoyed american pie expect expect convention make appearance love limbo gross romantic comedy definitely share laugh fist pumping moment good guy win situation every guy australian otherwise relate br br see liked american pie almost famous strength good aussie cast easy relate good perve value weakness predictable point rating,1
certainly one time fav episode trek much going one film crazy cool first guy beam alien planet thats explode meet freaky librarian type dude well played kirk manages get transported back much like th century earth mccoy spock try follow instead nearly freeze death frozen version alien world year past kirk manages get locked charged witchcraft spock enjoys amok time sexy cavegirl vanquished frozen awful world bad guy br br spock decides he happy he give mccoy royal assestment whuppin doc suggests need look way anyhow finally escape leaving poor cavegirl behind take ton convincing spock finally give leaf literally taste sadness end leaving cavegirl alone frozen wasteland seems cruel really touching spock must vulkin mind leave behind greatest hope love human albeit nice neighborhood br br anyway get much bang buck episode love story salem witch trial spock human desperation left total isolation abandoned three entirely different setting alien planet amazing managed jam one fifty minute film one classic miss want dvd fer shure vulcan,1
movie truly show farce hypocrisy indian society try show one side story side story hidden emotional mental abuse indian child movie show br br indian parent culpable following destroying individuality child making completely dependent parent early age child grow adult physical look remain child mind since everything provided great indian parent child automatically feel need work hard something learn basic human communication human being apart parent br br b show many indian parent try prevent kid making friend going prevent anything start making grow adult br br reason selfishness indian parent expect child take care grow old saving reach age cry loud grown old dependent child since done great service bringing world taking care making intellectually weak br br indian parent age dilapidated body health financially completely insecure feel absolutely need take care since expect kid take care br br west opposite happens people start planning age retirement retire financially secure br br indian parent nothing sort since like said brought kid world better investment br br victim indian parent sure countless indian kid like grown physically still struggling life continue pestering year old cry loud help time br br movie show one side story utter piece junk,0
watched film time never really liked fan termed nu horror dismissed account found little sleazy think thing irks hammer sexploitation aspect sex mind sexploitation surprised many people rated film highly another look creepy atmosphere bit omigod look bad stupid london prostitute woman little innocent anna get raped yet another nasty man ooherh suppose ultimately film depth whatsoever bunch nasty priggish men woman titillation value doubt degree victorian england like set even clunky dull impart sense victorian menace roger corman horror hand style atmosphere elegant horror exploitative flat footed trash,0
right hospital scene holly shannon done brilliantly start piper gurney looking badly injured doc race resuscitation room move gurney onto bed prue hold hand point obvious piper lot trouble breathing lung failing turn beg prue leave side gap go love pulse drop go cardiac arrest monitor show clear flat line nurse go full trauma mode bring defibrillator prue step back bed horror doctor desperately try shock dying sister heart response tragically pronounced dead well great scene well done girl,1
star rating saturday night friday night friday morning sunday night monday morning br br alice defeated freddy end last film trying adjust life unborn child carrying demonous presence freddy trying come world br br interesting note director got big break directing freddy film charles russell eraser mask renny harlin long kiss goodnight cutthroat island cliffhanger die hard stephen hopkins lost space predator russell harlin made good job hopkins imo made something podge entry quickly forgotten br br story clearly stretched far go freddy ludicrously father ridiculous looking demon baby even hour half get rather tiresome course scary br br bon appetit bitch catch phrase memorable point wise forgettable entry,0
low budget project film success story interesting actor convincing eva longoria star tv show dragnet sexier ever location ideal ganster plot director show talent taking many role project course low budget film could use better editing transition special effect gun scene music keep script moving although film share problem continuity must say would rent director next movie film student could learn thing director commentary,1
longtime fan original movie bella martha mostly martha everything make movie great enjoyable watch missing one miss slow pace build character style small gesture dominance light mood move dialog think story enough martha kate secluded mario nick clown case thing make one scene great original working copy small alteration take away tension opinion go see original worth inconvenience subtitle,0
ever said movie redeeming feature whatsoever answer yes one helming appalling house dead director uwe boll cast less talented eye towards yet another video game adaptation guy get anyone understand block capital video game make good movie acting best sub standard set design special effect poor unlike video game scary moment movie atmosphere impending doom sense danger menace pacing plotting confused paper script printed would better used toilet paper main culprit director uwe boll us camera grace skill monkey using paintbrush hackneyed zoom swoop pan spliced whole dreary affair unpredictable moment leaving audience disorientated bored guy ever let near movie set first place must stand one modern cinema greatest secret avoid cost,0
